{
  "schema_version": "1.0.0",
  "record_type": "controlled_helper_admission",
  "helper_id": "synthetic_bounded_helper",
  "helper_version": "1.0.0",
  "record_revision": 1,
  "admission_status": "draft",
  "owner": "replace-with-accountable-owner",
  "purpose": "Replace with one narrow generic helper purpose.",
  "source_identity": {"repository_relative_path": "scripts/example_helper.py", "sha256": "0000000000000000000000000000000000000000000000000000000000000000", "identity_scope": "Synthetic template only; a source path and hash do not create public Release or per-run authority."},
  "supported_profiles": ["standalone", "framework_integrated"],
  "input_boundary": {"caller_selected_input_only": true, "automatic_discovery_permitted": false},
  "allowed_action_boundary": {"description": "Replace with one narrow action class only."},
  "write_boundary": {"writes_only_to_declared_new_target": true, "overwrite_permitted": false},
  "forbidden_action_boundary": ["No data-content, credential, network, external-service, analysis, Gate, publication, release, runtime-installation, overwrite, or delete action."],
  "confirmation_boundary": {"preview_required": true, "matching_plan_identity_required": true, "accountable_human_reference_required": true},
  "recovery_boundary": {"failure_cleanup_must_be_owned": true, "recovery_must_be_documented": true},
  "data_credential_network_boundary": {"data_content_access": false, "credential_access": false, "network_access": false, "external_service_action": false},
  "audit_and_receipt_boundary": {"receipt_required": true, "generated_file_hashes_required": true},
  "evidence_references": ["synthetic-template-only"],
  "known_limitations": ["A record cannot enforce operating-system permissions or stop a same-authority actor outside the helper."],
  "accountable_human_admission": {"status": "not_granted", "reference": null},
  "explicit_non_claims": ["This record is not a per-run confirmation, M53 authorization, data-access authority, Release authority, runtime-installation authority, or operating-system enforcement."],
  "compatibility": {"older_package_behavior": "unsupported_metadata_no_behavior_change", "framework_installation_claim": false}
}
